PostType,Post_Content,Associated_ISP_Network,Associated_SocialMedia_Name,UserRole,Time,Email,User_Name,User_gender,User_age,User_age_group,Content_Associated_Media,Comment_Info_On_Post,User_Comment_On_Post,Post_Id,AI_Content_Similarity_Score,Fraud_detection_score,Associated_Page,Associated_Group,Likes,Comments,Hate,Loves,Shares,Views,Region,City,Time_Foreign_ID
Event,"Different help step standard. Stock which act rather. Subject police voice must until whose effect.
Science commercial successful hold. Ground drop safe somebody art discover appear.",CAMTEL,LinkedIn,Commenter,2022-04-09 09:07:06,debra72@example.net,nluna,M,12,Adolescent,36b2e920343aeb2108d6015b7995672b,Coach husband event phone such. Power camera water rich fire kitchen they.,Executive turn out decision design. Add out like writer produce article.,a593363f-7d72-46ac-8f10-882a96acc678,0.92,0.39,hess.com,technology,445,17,81,92,154,4768,South,Maroua,516ab9718788a169342250f4a3a0fa5f1cd4da3ea7d29b623356d1cc943bde18
Event,Anything short thank industry yeah toward. Director hour evidence throughout.,CAMTEL,Twitter,Commenter,2023-08-05 02:18:09,pwalker@example.org,richardrodriguez,F,88,80s,1da057c4b0514acd735095cb2c4fed06,Democratic far into around tell knowledge. We hope detail draw race under big road.,Teach central figure purpose.,b28e93e4-273a-47c6-86ec-680da002f709,0.41,0.41,bradley.net,tree,4,163,12,243,78,2877,Littoral,Limbe,03d3f7bdf2119ceb02530b6f7df018db16aa5826ea5ab123e5bda1ebf7fb1129
Ad,"Walk so no arm although poor. Store together instead environment reach cause. For people share thing.
Sea hit clear especially list. Scientist fight me between behavior range assume treat.",CAMTEL,Twitter,Commenter,2016-06-11 05:11:01,jenny00@example.com,jessica08,F,45,40s,e93d4be8de144fa25f52785092da06f2,Event behind away. Ability firm represent pretty deal money gun. Sing modern cell write.,Education that his hear cut chance whom. Court fly pull player decision especially.,fc9dc061-a32e-4558-b51e-93c68e44ab40,0.18,0.92,smith.net,memory,690,97,7,173,27,3859,Southwest,Limbe,584803ea75f4da3a353b14f0c1c6cfdc80c7cb81058c47fa2da21e1b33a1ebbe
Ad,Like prepare up especially election than choose. Strong fast more week get. Ago blue measure begin attention. Rock fly nation American.,MTN,Twitter,Commenter,2018-04-20 11:05:36,sierra58@example.net,billy31,M,60,60s,7b15b0b28649a20b5d5066e1d7c9e46a,South sea husband blood idea coach. Listen almost by his could factor.,North wind music others past. Religious more forget mean reality. Glass nature test event space.,c17341b6-2f9f-45c5-bd27-a6a29366b9c5,0.85,0.26,crawford-gonzalez.com,different,341,237,18,215,126,6408,Littoral,Maroua,4efdbd8a051945500e726248376be66512c20f90e96804573a2947853fe631b3
Survey,"War simple edge point. Sport help black order travel class just. Manager ok black star door change especially.
Full on expect approach would old red. Push thousand law article.",CAMTEL,LinkedIn,Poster,2019-10-31 20:51:56,morrisjessica@example.org,coopermichael,F,50,50s,6fd09a4f089af726a278356edf107683,Six chair reduce set since. Forget hot seat but.,Huge health us board to. Take responsibility various perhaps word can often win.,5e182e44-4098-4a1b-a8e9-f226b27754ec,0.72,0.82,henderson.com,discover,144,265,21,179,152,2413,South,Ebolowa,0e4d7ad09e0b541c1335b2f7359efc6f0410c29b444ad594085ae455fb9a34d8
Survey,Around place four college service. Mouth risk carry company pull quickly improve. Leave until reflect large fish ok them.,ORANGE,Twitter,Commenter,2022-10-28 21:48:43,wilsonstephanie@example.net,pbenson,F,31,Early-30s,e2462f9499b2390df69fef532e4dbd47,Long art happen response system. Firm left south coach yeah firm. What choice very always example.,Food threat quality. Wind anyone way let cup charge. Deep travel large time.,884fa668-ca0c-4918-af2c-0d65faa59b4d,0.67,0.91,norris.com,over,901,358,41,41,52,2517,Adamaoua,Bafoussam,1f5665170210ff00084c43479479b450116544bebce03f427672e1567886bdbc
Ad,Available her performance social treatment lay baby. Interview participant finally start military billion such. Will even consider question room.,MTN,Twitter,Commenter,2017-12-25 03:32:07,sroth@example.net,todd25,M,75,70s,42219e33f91d70e4823b729e5dd685fc,Tv very chance memory building pressure seek lot. Opportunity home guess share protect.,Perhaps no way brother nearly. Him form discussion speak.,7d3f5a18-2425-41a8-9230-a010341167c1,0.84,0.87,clements-becker.com,push,37,6,13,225,137,8150,Central,Ngaoundere,22622b4f258dc72054c0a61f5a494e1fcd04d628cf49443ce5739dc92c4b279b
Event,Get issue begin rise beautiful father money. Minute address social effect. Current listen enjoy production lot reduce. Late simply truth similar approach effort including.,MTN,Twitter,Poster,2020-01-05 05:56:31,travisconrad@example.com,kelleyjulie,M,69,60s,48733dd77f861cabeb4601f16c6af80a,Name the catch administration. Miss listen impact eat note from very.,Money outside treat sport. Through rule write industry back subject admit television.,97cf3d1d-21f9-4b89-8fba-63296b66b64c,0.05,0.85,chase.com,probably,219,309,39,126,116,1499,West,Ebolowa,06751a214043e9825d03cfb07f412eaf5a194a5e909d6c3df235d5874246281f
Survey,"What word several. Direction even more politics manager light.
Ten red tree risk. Research spring face finish bar seek TV.",MTN,Twitter,Commenter,2017-02-09 08:01:38,teresa27@example.com,michaellee,M,30,Early-30s,067d5cf9828e77ddcdd9c25854c84e44,Wrong force in land. Reflect feel focus report window.,Democrat parent suffer thing president radio. Painting also available until. Cup black become.,6305cc6c-ca62-4a5e-a7e2-41e265cbc374,0.77,0.52,schwartz.com,believe,44,285,36,272,154,6188,Southwest,Limbe,64955bc82476564226beaafc27f6dbba626e1778565c18f49849cd7ded118eeb
Survey,"Standard view result free happen. Author natural break society race. Animal kid evening forget general heart.
Cover point technology skill lose.",ORANGE,LinkedIn,Poster,2022-03-07 13:34:50,qmills@example.com,josephcarrillo,M,19,Teenager,a989c056a4a301661edad8eaca195ad9,Book picture security citizen. Action manager few worker third anyone stay.,Book simple firm cold blue edge teach. Situation be not student level green.,7be70dcc-f377-490c-983c-c9ce3e3fa2f6,0.16,0.85,fox.info,process,184,46,63,51,138,4982,West,Ebolowa,d7e02e2e3c096b1445e5a4c3b0a735974c65c0ffa520f65f470d848565425b54
Survey,"Everything everything exist better marriage generation. Sense mother data after end.
You course relationship six cost. Cultural score move field answer claim.",MTN,Facebook,Poster,2022-10-13 15:46:58,donna52@example.org,hannah36,F,58,50s,1ac06ecb141103d3ab8f87cb2487bcb5,Work teacher impact season some house thousand. Their about green throughout feel put.,First situation child gas. In though catch owner.,b8b591de-ebe5-4139-bec1-e9722d339831,0.83,0.19,medina.biz,discover,303,333,50,114,195,1143,East,Bertoua,e69ea94346bafb8509b0a89757f4ab7718b6ac6baa8292e5e0c5329b1317c697
Ad,"View phone history whom. Ahead article project son food. Time garden life.
List draw finish such. Hard catch finish choose situation. Common serve power model you picture.",ORANGE,LinkedIn,Commenter,2022-06-08 19:59:33,ashleycooke@example.org,pereztracey,F,53,50s,910d0d47d3bcc10ee123a5ed8a9a6a0c,Include position mean. Race source our north.,"Maintain land game senior world.
Control idea ever plant can. Image heart remain few operation.",35848d5c-4748-4b66-bf7a-2c008d5a3089,0.67,0.32,sandoval.com,country,87,464,49,6,18,9917,Southwest,Maroua,d00b4a0d9cb4c6827dea4176261f4cda44c31b4fecd63543bca81017ac73c352
Event,"Modern study bar between audience maintain position. Peace middle past place financial.
Seven five view same. Mean assume system wear these chance.",CAMTEL,Twitter,Poster,2017-01-15 01:34:58,robert79@example.net,castrodaniel,F,65,60s,166b98c2e988ea673448210e1d5026b9,Product stock partner fear. Carry feeling someone computer gun. End success dog magazine.,Real return song general over often human. Civil smile brother many wrong fly.,5a5472d5-5b79-4a5c-9e57-530968934448,0.58,0.15,mcknight.com,evening,879,149,19,138,148,8103,West,Ebolowa,dc959cb20700c8c2087bdabec7b2f90d5e14ec36cb0b5eebbb62f4fef917ecbc
Survey,"Seat then option. Value court win might lay.
Fish them old view phone professor. Chance product response enjoy cultural. Play able prove student individual.",MTN,Facebook,Commenter,2020-10-24 07:55:26,vegadaniel@example.com,alecatkinson,F,89,80s,d03ea665e3160d66378f2034337be232,Tell tree time situation sometimes cost. Work kid much body Mrs listen.,Face church budget every yes. Can station themselves century item area economic.,43941cb7-a7d7-4191-910a-d0ae5bc22f75,0.22,0.23,underwood.com,clearly,518,285,71,30,102,7554,Northwest,Ngaoundere,a4e7ea9c35a49d29d02b1e778eeb1b8072b2eb728d5bd01779762d78ae506ded
Ad,Describe chair meet pressure tonight popular appear. Very above language suddenly environment.,MTN,LinkedIn,Commenter,2019-09-15 17:32:31,laurakaufman@example.net,colemichael,M,20,Early-20s,e2023dac4745e272e8a013ccbf79c2cd,Message company someone military say story visit. Significant air call would.,Wrong score change direction. Thank party write.,f831210c-7074-4870-97b0-1209ec7574a2,0.34,0.14,ramirez.info,produce,40,313,66,104,41,8786,Northwest,Bafoussam,cc864f382ecd73aaf7f6255b26462c0fe0ad1296a656649fe25878cb4bd3b71a
Event,"Rule story morning difficult. Name need wrong color she kitchen.
Player listen paper gas develop because mother. Minute morning who operation. General each behind deal cut church.",ORANGE,Twitter,Commenter,2016-08-18 12:57:59,thompsonmelissa@example.org,coxedwin,M,40,40s,b28961abb70c70880e676d0ed34cb6c3,Get team see of yeah use. Record think when alone. At long put thus.,"Again message serve them.
Simply determine identify. Citizen office performance arrive claim.",da361ef2-5496-438c-9a87-1c49d8b54898,0.06,0.62,wade.com,popular,384,234,21,107,152,5762,East,Douala,428d9573b96929f01a80c371a7bb4c061e6d9887e75888e737dd84f2679c02f9
Survey,"Condition our understand.
Help force go discuss exactly. Central reduce case note raise.
Third skill specific think treatment affect media. Large wide song usually discussion action without.",MTN,Facebook,Poster,2023-04-10 09:31:47,vhouston@example.net,paulspears,M,41,40s,699c8e0f4e67687326539404028e54df,Remain some over side. Occur military fire window. Media culture recent table hotel voice.,While describe word fact show describe produce.,c369376c-106a-4973-802b-72f3cb2a5c9e,0.49,0.95,martinez.com,among,798,242,67,193,78,4188,West,Bertoua,18f25418babb1fd9e4baffb53884b1abd2fbdb6d75eec2fff3182dd766388350
Ad,"Act where position. Relate must out best it note control.
Station defense economic step phone. Project next carry market material office soldier third. Here in central responsibility feel.",CAMTEL,Facebook,Commenter,2021-03-12 19:48:44,christinawhite@example.com,vbrock,M,85,80s,534bf635a385abc442a0bceca631805a,Mouth everybody including here around message computer difficult.,Every with maintain head trade create manage. Return war task left.,84b185ee-6972-4fbd-afdc-6b9eb3c9f4be,0.78,0.55,meza-harrison.com,someone,578,46,15,93,32,6394,Southwest,Ngaoundere,9dac62dc8affe00e7a1f42657806e8266ea3679b3d1acb34cce1f30116eda4d4
Survey,First discover particular term attention create. Perhaps blood tonight write training across seat image. Instead of general audience policy compare. Plan wife what gas.,MTN,LinkedIn,Commenter,2020-02-21 08:44:57,lbrown@example.com,laurie09,F,33,Early-30s,88a7d5a54cd53ad0471f0196a794e1ce,Bring true down them our reflect watch. Turn everything half individual although area type.,Would town affect agent nearly college. Own property smile.,0d571ede-8002-4014-a741-a470717a45b5,0.97,0.95,james.com,hundred,224,337,36,188,100,4645,Adamaoua,Yaounde,08f7c24c72f4de166557cf10f7a9e1e20ee9eb1cd76131ebf1aadc67c0214aaa
Event,"Which defense amount particularly research crime. Lawyer be later lawyer visit education. Provide no administration bed.
Child toward rate court air game. Effect local risk very woman form.",CAMTEL,Twitter,Commenter,2018-03-09 16:34:50,bryandavis@example.com,ypatel,M,32,Early-30s,cb820b8d8b3a43b88a09b92c7cc2bdb5,"President any without.
Someone example husband seem.",Local life tree. Develop course too fill mind end.,49666dcc-295e-4b4e-abe5-efd6f1036967,0.64,0.04,haney.org,personal,893,170,93,29,71,9615,Far North,Douala,c81186300328011e5d4aedee7a8a2c985680714c9309d6d83e02021f8765e4ba
Ad,Cultural else decade development that before. Study eat author manage. Base clear plan power television yes author southern. Peace check daughter anyone particularly writer such nature.,CAMTEL,Facebook,Poster,2023-03-07 22:23:21,stevenbrandt@example.net,juanedwards,M,23,Early-20s,aa50564f5f3fe56f0aa867c9a3aea5d9,"Chair boy time arm skin.
Still east forget. Traditional well family memory.",Until east play soon voice forward next. Seat experience miss surface picture employee.,30f197a1-a803-4172-98e4-7f153750478d,0.6,0.79,jones.com,explain,37,14,68,216,30,923,South,Buea,a6326d46dc0b6d98c3b20d099f4f30db7d4baca0db9942964538c15783c11214
Ad,"Conference same hit hundred ready hotel might. Medical expect prepare.
Stock position poor try. Social choice affect read politics police budget interest.",CAMTEL,Facebook,Poster,2024-03-28 19:40:05,jjackson@example.net,laurahernandez,M,66,60s,4f661c0354b37bc4c6ede663bd796f11,Everybody before first side court series true. Rest first use class what company general perhaps.,Brother more special thing note. Different class beat administration early.,304c0e49-94ba-4a81-b1a3-481b3aed7b40,0.53,0.29,jones-smith.net,suffer,790,229,6,94,70,3370,Northwest,Bertoua,01df2f144e9b7b468f345da8ad6cc01b062f7dbf0f71b89a4b6a398fcf17e011
Ad,Cause do major much.,CAMTEL,LinkedIn,Poster,2018-11-01 08:02:54,scolon@example.net,warnerchristina,F,94,90s-100s,52c5fae5cc103a4df45ef2b3bb8fd073,Break method weight side they. Ten doctor suddenly test dinner. Within as camera today poor reach.,Maintain sell already feel could. Myself song phone why collection around.,ed9af350-5dbe-4a9e-aaac-e82586767537,0.87,0.48,mitchell-lewis.com,available,583,214,33,26,133,1428,East,Garoua,85d6eb4237a665cb6ff1c2bf6341fc10c6882e2ef877262e9aea16bfbbf86ac2
Ad,"Citizen style travel fall get money difficult.
Compare fire rich room ok. Improve various begin serve above. Record look cultural position claim.",MTN,Twitter,Poster,2024-03-16 11:17:44,destinyellis@example.com,stevensmichelle,F,13,Teenager,6adc0a49cb10ad4653a52ac7ad65ea60,Price far wall simple case understand. Effect then recently whatever.,Power their term fight. However budget red task term.,2cc2f98c-c097-4cb4-abd3-121c77ac93c5,0.09,0.15,miles-roberts.org,want,754,76,63,91,196,5148,East,Bertoua,97d445dc50cd32fe3d321c04a3471f23f57c4a960809766ea98b1e567cadfc5c
Survey,"Stay enough during view office. Available sing staff. West nation ago forget reduce. Follow under world spend.
Baby vote actually news sign. Unit staff work town.",CAMTEL,LinkedIn,Commenter,2021-04-19 05:17:08,ulester@example.net,dandersen,M,37,Late-30s,a3ee71dd07f75c10469e32b0c17252d3,Later often opportunity shake. Reach like oil and. If contain set travel group week.,Say carry program old. Public friend seem rule father pick it. Executive fund really.,d5da115c-f9f4-4192-a729-8a6a5ecfe0d3,0.84,0.72,gomez.com,daughter,26,122,3,75,107,7697,Littoral,Yaounde,8ecb6b9046b2f55f16c10132449ce6e63a67debd593eb197cd7c96ff0d11ca2a
Event,"Low high but really certain likely. Use sit why. Job media lawyer should idea TV soon.
Believe bill instead thus among to. Quality all remain activity after half dinner.",MTN,Twitter,Poster,2019-11-24 07:47:23,ramseyjohn@example.org,jeannephillips,F,80,80s,8cc8686372f3c91657a4da4b6bbf69c5,"Program line all follow about quality. Manager field box land.
Power then gas feel.",Blue throw close reach happy center action. Partner million amount indicate bank.,14ff8e68-2b6b-45f7-a663-89e392e461aa,0.52,0.93,osborn-lewis.com,provide,182,179,70,248,143,9091,West,Douala,82bca82bc97356f11bb92527cd1c263fd20442cdb92a2caabc16f0e901571b64
Event,"Sea know message several data. Area base cover when religious not. Event toward exist second.
Still type likely task. Value bill like sense ahead every.",CAMTEL,Facebook,Poster,2016-10-31 15:52:08,tvaughn@example.net,barkersusan,F,91,90s-100s,5ee5a5e9363c9e5ff255f4b4082c36f2,While what walk. Person as around physical feeling.,Rather serve leave road these. Television tend audience billion wonder ever worry.,39f9d787-30b0-4200-a61f-70593f06cd2e,0.32,0.93,schultz.info,worry,286,134,85,259,56,3744,West,Bafoussam,ae98f3dc466b812de72fcc27091509fb95f12956fecce1b7fa603edbf4ce7050
Survey,"No weight identify sense behind maintain with.
Source brother little current summer those. From set wonder line eight. School remember start at in offer.",CAMTEL,LinkedIn,Commenter,2023-07-10 02:25:38,sara67@example.org,john90,M,18,Teenager,f5e29438773b7454fbb0159fdcfcf770,Authority police truth. News receive seat its walk close under despite. Choice go strategy.,Name service a arm work. Idea senior admit like three data common.,8e4e3486-5283-4984-83e9-df8abcc72367,0.48,0.22,mitchell.com,theory,366,296,51,116,118,9461,Northwest,Bertoua,a41a21ca840047058762a904e937b6272ae6d62ff0ce34c0114616befe12900e
Ad,"Personal certain than. Its indicate nation notice part part.
Former glass serve eight. Money one subject mission election future well statement.",ORANGE,Facebook,Commenter,2022-05-12 11:37:10,victoriawilson@example.net,nalvarez,M,50,50s,360f83e1bb6c4fae3f9d25bd9284a6fe,Mr oil ready those condition staff. Result however consider resource.,Order country event total understand. Reduce food matter. Live dark low focus state day condition.,86667651-504e-4fd2-9483-35699e7fbe16,0.98,0.4,brown.com,worker,119,200,47,27,64,7085,West,Buea,76ee504466bccd329b133806be463f5d3832353e4874b0e70509c1d9d4a45a2e
Event,"Point stuff focus matter film drop remain. Cold left test.
Money event majority much concern. Green worker adult page.
Job pass economic coach worry student. Significant such cost your.",CAMTEL,Facebook,Poster,2020-11-13 02:50:04,vschultz@example.net,craigjordan,F,17,Teenager,418871b5e4f455f087fd0b75be79812f,Language evidence team herself. Trial themselves suffer town risk artist.,Moment deal American page every trade. Nothing recently enter huge say.,b56c91c4-861f-4a22-80aa-b8406986ff08,0.13,0.7,allen.com,style,563,308,1,17,149,4655,Far North,Garoua,8ac8424d4b3d464e3c221704ecae02f094d32bd063e363cc30f98328d25a31a6
Event,"Onto subject realize compare.
Site skill research behavior perform production. Shake wait remain low well.
Reason agency police ready special call. Letter difference if interest song crime note how.",CAMTEL,Facebook,Commenter,2023-11-15 14:19:54,josesummers@example.org,wsingleton,M,11,Adolescent,f79c3e67d19782216f1dfd5b5d39ebc2,Own everything face ever character might. Attack series rise within. Serious cultural cup set line.,Western popular sell little help military recently none. Main wall policy become forget game.,f5e96d21-1325-4133-bdcc-8963ae2a3e96,0.11,0.05,williams.com,someone,300,406,36,39,164,9067,South,Maroua,1c45e71dde8f295c3700fbc4b2995169cce7159321985598dbccd0e77cb95f70
Ad,"East chance let finish. Address office beat hard perhaps.
Pull edge believe attention like speech he fish. Challenge capital type leave what. Recently sit meet yourself.",MTN,Facebook,Poster,2016-03-05 01:38:25,daniellehamilton@example.com,smithjason,M,19,Teenager,8ca3d7c5546f4af5d4b3d1a194337b09,Expect which range bit particular design. Finally area similar camera catch contain TV bring.,Evidence arrive her chair full where suddenly. Space to people eight effort audience.,6593734e-e241-4d90-9b90-cf4d9d1de377,0.47,0.04,pratt.net,same,599,85,98,124,82,8625,North,Ebolowa,7f923a46d3622558da95420aefc281abe4496f81556d233a143fcc214e64d7d5
Survey,"Cut concern community south hotel occur whom. Want process indicate character situation debate improve. Image positive across.
Old watch modern let.
Laugh especially receive make offer number.",MTN,Twitter,Poster,2018-04-05 10:35:06,stuart27@example.com,vanessa72,F,12,Adolescent,a8a76357d3e8dc0af643b126f1c2ff57,Face people husband might itself side. Nearly report interview grow.,Property cause expert prepare. Bed green identify.,baa80191-7f75-414e-839c-2ce37c06ab54,0.13,0.04,olsen-baker.com,quickly,197,133,76,136,32,889,Central,Bafoussam,a47bc4d43ef1dba5b3c8da8ce41c884bde3ff3240f1ec70110ab77f76ef9b89a
Event,"Happen fund fish film effort. Statement move entire hot actually leave.
Particularly much improve investment. Three eat south maintain.",ORANGE,Facebook,Commenter,2018-12-04 05:34:53,lesliemarsh@example.com,sarahrangel,F,42,40s,c890361de5aab175b2099852e3ba7177,Hotel Congress I speech. Page thus center moment reflect middle stuff.,Represent reality tough report face state including. Reveal tend threat.,ba546ac5-4863-44ce-b405-2319a2657bad,0.65,0.26,thomas.com,music,966,232,73,277,147,240,Southwest,Limbe,45588d7323cdfbff19d1ed3d7f719db81b57eec42535efac469784d28ab41012
Event,"Coach others owner international until apply. Eat tough data state send inside benefit near.
Job however trouble international majority shoulder back recently.",CAMTEL,Twitter,Poster,2022-01-16 18:17:21,abigailking@example.net,ramosemma,F,32,Early-30s,bea338f6570240bdeed86d75f5616f51,Machine answer find firm short movement. Only develop scene plan.,Mission dark expert coach thing. Ability stand media either.,949a00ef-078e-49d4-a185-974421fd6d61,0.04,0.9,cabrera-brandt.com,claim,855,343,99,158,22,917,Far North,Ebolowa,f3a23309ff9aa148f6c5e582e25e335078f2ea1e738a891ca838b99756bd6ee7
Event,"Or know window stuff long. Current some nothing nor. Our page allow tough discuss maybe effort take.
Early dinner cut per along often. Lose leave accept easy both. Bar data magazine continue.",CAMTEL,LinkedIn,Poster,2023-01-28 18:20:52,hickscarrie@example.net,pollardamy,F,46,40s,c6497f16364f58aa86fb199ea1bb74f1,However among detail determine yourself. Decide them wear art would charge.,Moment program best write office across. Buy with pick certainly add.,ad521ea9-7d52-4dee-880e-1b898e4009ff,0.9,0.19,gonzales.net,turn,979,145,24,226,132,4712,Adamaoua,Maroua,475e720cc01845d1fdf0ff38bc8ece9c0ba53b35335adabc75d0342fc487dc15
Event,"Summer coach past development agreement. Coach again list tend their way.
Meet none each up. Happy movement want him.",ORANGE,LinkedIn,Poster,2022-01-19 23:00:09,wheelerdanielle@example.com,crystal32,F,90,90s-100s,df8b4817079973317c8c011cd6faf5bd,Bar approach recognize. Town throughout they many mission interview inside.,Fly people choose ok.,3837accc-9be7-4b41-85bb-1332262490a2,0.76,0.97,thomas-valdez.info,sell,565,43,76,294,148,7171,South,Ngaoundere,3d1947850909a020a22a34261b427cce126cc591af822cffce753068045d2955
Ad,Off however design theory current success include. Board later drug open ball. Option group support store.,ORANGE,Twitter,Commenter,2021-11-30 04:35:19,higginstoni@example.com,herbertgeorge,M,90,90s-100s,2c8224eda4021df24ac1a0b94013856e,Day social while top. On population yes collection because find.,Pressure table message media involve. Father way feel full benefit measure.,c151d0fa-e942-4a47-b0d0-ae702502e36f,0.24,0.35,webb-cannon.biz,statement,237,244,0,123,156,3959,North,Garoua,3a12fd092c87309ae4aea3667f1253a228054ba5190e504d7f83b967426185ce
Event,"Beat interview organization eat her light. Heavy really without coach.
Stay free what white perform strong with anything. Us night include card mention military million.",MTN,Facebook,Poster,2024-04-08 01:55:24,jonesjoseph@example.com,karimckay,F,95,90s-100s,064cd7ccbad4f7d88a500a528617924c,Life then fire get almost amount. Table development million.,Song who whatever eight discuss individual. Laugh blue current former charge enter.,25f31389-5cf5-468a-99bd-d0a1218932b2,0.67,0.02,rojas-allen.biz,movie,828,283,50,136,149,5948,South,Yaounde,7eb0ba4c5d8f39b410007e8e40b06eee1e85f123d8b90a5a1e5f7339457fba38
Ad,Different agree board look interview after dream on. Will other kind send goal fine front. Walk behind there.,CAMTEL,Facebook,Poster,2021-11-26 08:46:02,nashandrea@example.org,johnpage,F,50,50s,8bf2d42de836fc863b852274bc743991,Degree city change like again there affect. Forward design she economy over front season.,Provide senior present better generation security. Two describe science than so evening.,3211428c-9e02-4ef4-9ab2-112ad17db639,0.92,0.85,lamb.info,he,242,397,4,72,194,8094,Far North,Buea,fb50d2932bc1815724ee6f2e834e35027f3e666de0691f93bf893186a60eff9c
Event,"Suffer significant girl another activity poor.
Control federal tonight think power seven middle.",ORANGE,Twitter,Commenter,2024-04-11 02:51:31,laurenflores@example.com,dnguyen,F,76,70s,f0078658e1b4ddc6ab9e4700b1436c7d,Over much believe player performance nation. Floor woman available.,Employee middle close training from. Wife every all behind. Organization indicate buy drug.,031aece9-e2af-4a4e-aae1-bc68d93ba408,0.26,0.06,taylor-baker.com,center,835,466,91,109,176,7936,Central,Maroua,7ef4434c94116111f8f8a219fd13d71a0d19e4d819ff640eb3f2e0d9e5c7ab85
Ad,"However to we his positive inside book positive. Bed grow light live employee serve.
Think if no site finally. Part sing subject watch morning force. Another must deep put worker issue grow.",CAMTEL,LinkedIn,Commenter,2020-07-01 08:29:42,tracyoconnor@example.net,bconner,M,92,90s-100s,860ab9232bca15bec8637bdce6cd2186,Game above perhaps month speak under. Gas possible stock sister group career spend.,Successful far season talk street. Half great form add letter attention second recently.,11a9cf80-a9f5-46d0-beed-1bad5cfb9292,0.28,0.29,johnson-wiley.com,morning,68,174,55,65,116,7203,South,Bertoua,931155f7610add5f94474467db9749ed7c83205fb970a68ae84af6e23644f1fc
