PostType,Post_Content,Associated_ISP_Network,Associated_SocialMedia_Name,UserRole,Time,Email,User_Name,User_gender,User_age,User_age_group,Content_Associated_Media,Comment_Info_On_Post,User_Comment_On_Post,Post_Id,AI_Content_Similarity_Score,Fraud_detection_score,Associated_Page,Associated_Group,Likes,Comments,Hate,Loves,Shares,Views,Region,City,Time_Foreign_ID
Ad,Third rise meet party dark morning eye. It within notice condition media him none clear.,CAMTEL,Twitter,Poster,2025-01-08 15:43:55,lisamckee@example.org,mark82,M,64,60s,e979a09584755f2decf94ad38d09d5c0,At even half wind laugh within manage. Cut tree marriage say.,Difficult interest less catch. Listen pick treatment seek. Phone try argue fact.,ef5b1b51-4c27-4918-bc9b-57d709f40087,0.83,0.02,cohen-smith.com,treat,294,168,16,154,148,3898,Southwest,Buea,91af492aeec48d3a698b6d34e5e86894d37451d6c5e6f187f0d3d18285828bcb
Survey,"Cultural good allow down project finally community. Arrive economic near floor despite remain.
Issue heart space despite two defense later hand. War again glass age that race.",CAMTEL,Facebook,Commenter,2016-07-24 06:45:24,sharon92@example.net,udeleon,M,53,50s,3d7b7e912d63847a5bb747f079364f90,Oil former successful you important recent each. Mean able more ask garden.,Whose serious pattern sign real. Of suddenly you environmental meeting.,b9d3fc22-934a-4531-b04e-0a80e0eaed58,0.3,0.01,gonzalez-smith.org,admit,845,294,18,22,44,7107,Central,Ebolowa,d8f15a8a3f10656ce1df29b12679b1085ea9275d402d1ebb2b7dcd817ced3dab
Event,"Behind friend design.
Loss industry record act.
In old hotel community production cut market.",CAMTEL,LinkedIn,Commenter,2024-02-29 16:30:17,bryanstewart@example.com,alvarezcrystal,F,43,40s,11611f0a1de7af011165949709fde4c3,Baby better word wide they. They exist firm base short.,Age next other check sea price. Since accept debate item. Gun wall ball simple process.,a4405d6f-639a-4c73-a777-bc99b663628a,0.09,0.98,hansen.net,character,752,178,37,50,10,9487,North,Bamenda,9bf637bc3a48e8946fe902f819abff081601bd4af360e9f302ffa57da8381a98
Ad,"Down think threat official another. Their set cost foot base measure job. Unit poor southern east themselves exactly.
Take lot determine which imagine sea.",MTN,Twitter,Poster,2018-07-28 20:09:09,michaeledwards@example.org,aimeekelley,F,38,Late-30s,5ee1e625f639e5f3aaa367b9f526b33c,Wonder become social ahead nearly sport total. Not day peace rather determine spend brother.,Administration month partner training. Dream heavy sign always bag write nature.,e70c99d6-77e4-429a-82dc-028fdc759347,0.56,0.14,fitzgerald.com,receive,830,76,4,62,163,7420,East,Ebolowa,9b5ad17a46a16f4ecd3eef409b7cda570e333d835dc30436add29dd8d002719f
Event,Consumer from art. Play window become main race middle must. Someone world sign purpose exist.,CAMTEL,Facebook,Commenter,2020-06-29 04:19:46,holly48@example.net,mike16,M,89,80s,7456ec10b3fda7e60ae37746b4606f97,Institution enjoy business question citizen into.,Catch pass north establish state. Space place each top bar.,f42daaee-9cd1-479e-92d4-dd2fda326e93,0.17,0.72,hood.com,least,77,284,86,173,139,8135,East,Bamenda,b5ca4be1e634b2231ade81f045eff0da313e2be4fe25a5b26dbe26060e84199d
Ad,"Quite daughter election a form major young.
Several she language range. Everybody involve little film future force factor. Remember report somebody music writer citizen.",ORANGE,Facebook,Poster,2016-04-26 12:57:21,qmorgan@example.net,patrick50,F,83,80s,838f63bda486fd7ce438f2177b37c51a,Paper spring amount certain executive growth. Report sea this teach go.,Dream civil direction election probably however. Statement religious above child popular evidence.,4cf88d87-d039-4146-a693-2732706505fa,0.63,0.8,osborne.com,study,592,454,68,257,129,3118,Northwest,Maroua,ce8f1007dfb6d355def6d88070e4571ed3cce31471c47ac25c0ced8459cdb64b
Survey,"Represent degree investment. Hot catch far decade station. Garden family place father politics.
Manage remain hot guy their last. Poor pressure carry. Drive real foot church house.",ORANGE,LinkedIn,Poster,2016-05-07 03:24:16,brenda04@example.org,adawson,M,19,Teenager,956f1536eb887f9725ece8f3abbfd2bf,Get keep plan fish. Energy between player model front rich member.,Left create week time organization hand. Company hour heart wait nearly next past.,f00ec9c4-a174-4319-86e1-4422587e311a,0.08,0.94,mendoza.com,program,835,220,66,103,124,6407,North,Garoua,a6bb6dc27e8a1d25faf8021c5a339cd6f6513f4918d3ab718c1907948f1e666b
Ad,"Strong area side agreement today society.
Box possible baby fight. Design of nature central majority make window.
Debate shoulder west foot become beat control. Health forget market strong involve.",ORANGE,Twitter,Poster,2017-03-09 03:31:28,carolynkelley@example.net,hamptonkimberly,F,23,Early-20s,bc13b92f36d26f67da37b9984beb58a6,Address finally product able century view year. Top ready discussion of break. Back teach race.,Bag likely certain action.,d40c59d4-73ef-43bd-a375-84b39eb32282,0.38,0.79,frederick.com,free,815,307,0,19,92,6215,Far North,Garoua,dabe84b670eec6ec506c9fafaa37c7ec2696074e94afdbd09d3ccca42cfd32c2
Event,Condition indicate material. Main check lead toward. Accept line national area music project hair.,MTN,Facebook,Commenter,2019-11-09 05:58:31,brandi22@example.com,emily16,F,81,80s,0ff7d4165ca059e57e95e6bc6a4f9a6a,Change police foreign page visit in. Break whom image there.,Majority carry listen still myself. Appear dog language always.,43acc70d-f5e5-436a-b6a5-1032c50cfbb7,0.14,0.68,strong-brown.org,natural,424,282,47,5,116,1091,Central,Douala,9b793c8178f0b4ef5bc4b397afdd50595e29c2e6cbc4f4473f4517cb465166f8
Survey,"Event send possible who drop. Must pressure husband argue.
Allow president despite word program. Ask spring indeed base.
Bank hold pay even itself.",ORANGE,Twitter,Commenter,2022-03-17 21:39:54,cthomas@example.org,james09,F,45,40s,69ff4a3d5cf2466a4467693c24168432,Official network present she listen nor. Away father travel.,American number yes. Now long too never stock claim.,e2f8940b-91f4-45ab-9f44-bf436f413048,0.35,0.34,gomez.com,politics,86,499,73,286,110,8134,Littoral,Buea,7fdc0511a039ae01729c192828bb92202dfbb852f9981df01770c7b5069e167d
Event,"Both guy offer. Trial effort significant international single challenge a.
Whom people put citizen true. Hear so mouth above hand together thank.",ORANGE,LinkedIn,Commenter,2016-02-05 19:55:41,nicole83@example.net,jenkinstheodore,F,36,Mid-30s Adult,572a991d28990930262ad0f57ace4574,Across doctor full difference southern would court. Catch century mother short reduce.,"Box sing threat. Someone financial our.
Point but important.",007a82ee-00bb-443e-bb87-d95ff0bf86f5,0.56,0.3,hall-quinn.org,hear,600,403,53,100,72,9614,Littoral,Bafoussam,93e1a2dc0ddac723da3dbc1937449eb5dd8d447825f8926702477aefc428d63d
Ad,"Detail get great culture run investment. Officer network yard mean technology.
Sea simple spend seven sure. Drug bad color. Beat door indicate yeah stop wait success.",ORANGE,LinkedIn,Poster,2023-03-17 05:58:34,calvinmitchell@example.com,levi12,F,64,60s,c4a43c9da03aa535cc58c07a5ceb5774,Wide safe audience industry. Dinner third candidate dinner.,Computer kind one adult. Fire property she someone. Threat Mr task street.,37bb8cd1-deca-4e56-9be2-de5fac99ed98,0.92,0.97,mcdaniel.com,each,454,281,29,82,48,9788,North,Bafoussam,0fbb5d9abfbc99287dbcd2cc4a2dd2b48c1271fed157128930a2ff84adb7b0ce
Ad,Present over law. Treat me from Congress course. Collection something matter say agent stuff feeling. Plant drop court management realize paper.,ORANGE,LinkedIn,Commenter,2021-03-15 23:28:25,dustinhawkins@example.com,carolyn69,F,92,90s-100s,3460d00a628babd65aa69fc9e1545431,Throw partner same fish. Happen sort society wind possible law.,Movie example my bill buy. Focus research include magazine stand real matter.,9212736f-49f4-44ac-8ff5-79332c3d890e,0.23,0.5,randall-clark.com,response,849,267,71,1,54,2023,South,Buea,6cd8424b8f295e46fc434acb281bcfb34903b4f2d046eaa5e4d74fcc12b9da3f
Ad,Series no less sense art hundred onto. Morning show last purpose consumer ability forget. Relate idea around.,ORANGE,Facebook,Commenter,2016-08-07 21:41:30,carrie98@example.org,michael72,F,58,50s,9ceb5e1ae11927cf109fbc5ad8cd6d3e,Their personal school realize. Home include any country. By operation room cost industry.,Often turn plan government after. And weight money this purpose team represent season.,247caaa6-0f9a-446d-ae83-659350297f54,0.22,0.44,cannon.com,treatment,710,186,28,289,6,9948,West,Bertoua,89ff2bea1bef229d23a93655e2a939093c7028b65b9faec1b99b3c96d3456c84
Event,Bed late however quite off necessary kitchen sort. Resource administration little management item green. Mention society send us performance pretty.,MTN,LinkedIn,Commenter,2015-07-23 05:22:49,jasmine40@example.net,codychase,F,45,40s,0209bfe42b27b87b3ae5784ee5706459,Building oil paper method. Sort present down. Democrat friend break too draw win particularly me.,Hold recent whom investment yes participant story. Kid character general half north.,127ab441-403a-4830-9357-25ba2806d42f,0.97,0.84,fitzgerald-crawford.com,interview,791,14,33,33,147,2651,Adamaoua,Maroua,525d426a9b330f6cc07f51e44c15d1eb4137f185bdc811d901961ed674f1128f
Ad,Talk hotel gun. Program herself brother debate fear significant reach environmental. Brother debate teacher else might provide. Television space accept actually reason security wind able.,ORANGE,LinkedIn,Commenter,2016-01-03 08:31:36,johnbentley@example.org,bethanyblair,F,97,90s-100s,9a18224cb228b28f59550ad55a1a2b99,Popular visit site specific. While operation sort tree decide public lead. Finish beat per.,Size democratic crime relationship else paper. Century expect build civil with another rate course.,eb56ed0b-c39b-4e55-a0ae-3954d58c2707,0.96,0.11,preston-sanchez.info,left,953,486,26,205,152,7408,Northwest,Yaounde,f2031e1b93009541e76526210f8ca8209c244bd34ca1794fee2cc7a1b1d1324d
Survey,"Them leave help stuff hear central. Paper beyond write chair receive media.
Southern size million per. With surface PM arrive about.",CAMTEL,Facebook,Commenter,2018-10-07 20:08:41,inguyen@example.org,dcuevas,M,32,Early-30s,4cb0ce38c50b6cfcb30c499c6fb26117,Officer identify hard. Then guy will tend yourself contain.,Decade send cost else feel. Range issue with race program modern around.,db66b244-48a4-4087-82a3-0f60893ccecf,0.64,0.08,malone.com,statement,262,31,94,183,145,6030,Southwest,Bafoussam,89efe48246d2057cb436142280004bd6bba00633d8a2e6c248a820b73cccd570
Survey,"Nothing still personal. Behavior somebody million above room strategy father. Wide model chance.
Cover reach cultural strategy situation concern interest. Cut return financial member fact fight.",CAMTEL,LinkedIn,Commenter,2015-02-20 03:27:23,fwatts@example.org,hgray,F,39,Late-30s,9986deaacdb918cd14d95f52ae05a87a,Truth up foot happen. Gas pretty sure land speak country interesting.,Free Mrs professor agent agency. Beautiful life western through.,10d3b4ce-f10b-45ab-a36a-2d03c3a256dd,0.67,0.22,chavez.com,he,484,296,60,232,166,5816,Adamaoua,Bamenda,d2104d553b9e0f4fe1170bec9134f4cf8eb6cdf7025007e9986d5467d4094732
Ad,"Book job for continue.
No everyone avoid outside level education five movement. Anyone them ready administration while region we.
While race mean together.",CAMTEL,Twitter,Commenter,2024-10-01 16:43:02,jonathan67@example.org,phaley,F,75,70s,5839f5a6237dd29c83b823e0b3c6bd41,Pm magazine trade market strong set. Plan him sing figure candidate blue not.,Or theory piece wrong its. Process peace black those if protect.,78f0845d-fe98-425a-814f-d839457b4c07,0.82,0.11,rodriguez-duke.org,it,96,321,94,294,23,1834,Littoral,Ebolowa,a83a7a90c8aa2ed14caab33713b0bf0b560bc264f6d0882e72bb3c0f74ded9a8
Event,Capital water dream family two seat team. Author market herself history night skin. Along pretty think claim spring hot course.,MTN,LinkedIn,Poster,2020-01-16 15:17:23,rodriguezmatthew@example.net,fmay,F,80,80s,9398b05900c9900d15939658d1e7fc12,Your media should century stage chance. Message kind center effort.,Coach strong southern away. Military country magazine without box. System worry recognize station.,b2a2d7f1-18a6-4323-8832-1a4cb4891c64,0.53,0.84,marquez.com,main,448,187,89,73,198,7217,West,Ebolowa,63661c415ba8af2eb31227cf2d05924235e86dfa6d268d6af424215c5b87d6a3
Ad,"Finish always need decision old. Season matter hand himself technology example check research.
Concern remain size quality star. Article growth case physical everyone.",MTN,Facebook,Commenter,2019-08-11 17:54:02,yvettebanks@example.org,ryanruiz,F,87,80s,4a1c52d80322ff3275ff88ee70407e6a,Third talk religious yeah event capital. Draw model six surface around money across.,Or hear thank song. Charge organization nor call. Exactly alone partner quite power claim hold.,17c3e272-8026-46f9-8c7f-8b37870e44e5,0.81,0.59,kelly.biz,our,819,463,55,112,98,4063,Northwest,Maroua,a3246f829af7472be8beee64149ed145fe9d46937257919e2053ff5d945bb28c
Event,Safe oil establish follow their political. Almost nature affect score rock direction. Just society more.,CAMTEL,LinkedIn,Commenter,2024-05-04 08:45:20,rnewton@example.com,hendricksjessica,M,45,40s,6acd28b94547898d376a5c492f45831a,Family environment trade something wish subject president. Top effect that.,Participant total wife yard accept science. Most line response field off physical.,c2e99117-cb9e-4237-b65c-c5e1e856ec47,0.44,0.88,campbell.com,class,831,74,82,196,179,1934,Northwest,Maroua,2798ed48cd51c441697ed3b2ec6349df9130c11b3e041d2252ce17da14973687
Event,Already mean expect behind order page. Size worker center detail hospital. Set carry into program.,ORANGE,Facebook,Poster,2015-06-28 06:37:52,michaeltaylor@example.org,hahnabigail,M,85,80s,0bd4c7fc1b721f582969916b064994a9,Other fill onto store meeting establish. Television pretty join recently age political.,Air green end put decide. Great music capital doctor culture. Camera early off form.,9006ffbe-9a5d-4c84-8aa4-e4a13e8fc1ea,0.44,0.44,wilkerson.biz,make,966,266,81,106,76,1574,Northwest,Yaounde,0a0be6f02c7087d4e2dee2e61b3002f157d930270385e0e3e403e75bd677b75a
Event,"Economy especially know share image tend. Outside beyond billion operation. Film again late wear build.
Our any fact see contain past.
Resource why type garden.",MTN,Twitter,Poster,2015-12-19 10:01:04,jennifer27@example.com,clintonellis,F,21,Early-20s,e1274812b946223a13753d0c29516a4e,Truth same care trade. Away today week sport every recognize.,Name popular data executive contain window their. Particularly system family.,a1b43715-aa0c-4dd8-a901-5f6a0270a926,0.3,0.66,gillespie.net,south,209,295,7,178,98,8973,North,Ngaoundere,8832231ed0f347ee5e176a3be6a303bf75f7ea638240b9b39f29ce0f08fbb171
Survey,Student investment do what talk. Real school education hair charge thought. Risk child too win growth on.,MTN,Twitter,Commenter,2020-08-03 10:52:56,kellyvanessa@example.net,riosamanda,M,15,Teenager,38371524ed79d8aa195dff723be014bf,How dinner if service list bag finally. Manage fast last past ago color. Seek matter send affect.,Player top performance. Expert upon amount fish hotel.,b8393c8e-587e-452f-9f1f-5b5e5e12c5b8,0.41,0.31,daugherty.com,address,518,67,54,253,17,2575,Far North,Ngaoundere,dc55a599cecf7490b2c0b0937e872009b62daf19dd42efa2d6ca865d61e04736
Survey,"Machine avoid whether in item safe draw. None within who life event.
These available level laugh. Notice time program down firm. Throughout keep matter democratic.",ORANGE,Facebook,Poster,2023-02-03 18:03:38,melissa14@example.net,gary44,F,53,50s,d04e2f7539ff749f82c19f497d3279fd,Common society above measure nearly. Unit majority effort door.,Garden happen quality main. Base TV official bill fund sound.,67920d98-c920-4d7e-a115-95ce22bcd2fc,0.07,0.17,morris.com,including,683,134,46,177,130,8555,North,Maroua,12b695661bf6c37cdfbd281d37346e3e1857016d5555d4bc1e83949410457332
Survey,House change financial whatever rest. Moment teacher agreement product. One democratic back toward language themselves central.,MTN,Facebook,Commenter,2023-07-11 06:11:21,suzannebrown@example.org,rperez,F,15,Teenager,3a49226aee0fb97727ecb06402e04dc5,Beat other shoulder policy during. Toward stock rule perhaps let perhaps.,Hotel role area type.,39d2460b-8ba2-4151-bb6d-1a4c3d168053,0.87,0.96,jenkins.biz,most,723,31,30,284,144,1254,South,Garoua,7b8bb2b4d053a6f6553ba8e4b421ab15a3993dd1eafb8663e9a791df67e8c24d
Ad,"Course government station model camera Congress son major. Soldier throw turn full suffer.
Middle form special entire. Get or bit hour card past. Outside form these hot but.",ORANGE,LinkedIn,Commenter,2015-07-11 11:02:22,michael90@example.org,scurtis,M,46,40s,1d18d29f5f45b679551cd3066bd5eff3,Build any hard PM sea work. More with rule. One result kid employee.,Want guess might. Voice sister usually major of agreement join.,768abe2b-ca59-4fd0-abd4-0aa92d7ec9e4,0.96,1.0,anderson-taylor.info,blood,943,363,83,174,32,7055,Far North,Yaounde,54eec006ac98b2aec271206a05a1f27182a95737d9d1b9cfcbd7cc26b279534c
Survey,"Parent forward pressure. Five ok everything allow central Mr.
Cover see main. Law soldier three everything.",CAMTEL,LinkedIn,Poster,2019-05-01 18:41:09,frowe@example.net,williamsmith,M,64,60s,628f740293eee5a1e70df50ab0a6916b,Program television responsibility cut month participant. Test court people together.,Start surface product. Hundred both finally positive.,2a7f6620-8e67-4f2d-92f3-eec1f2a6f893,0.45,0.14,jones.info,share,126,280,89,276,112,6927,Adamaoua,Garoua,459538afae95b1d19df615007ac994726a56e034702868bb96289b83eea609e2
Ad,"Rise difference civil. Simply above design improve goal character space. Act conference economic customer instead.
Maybe west civil hotel phone eight tough. Along rich moment growth.",ORANGE,Facebook,Commenter,2015-06-25 21:47:32,colleenclark@example.com,gskinner,M,42,40s,b124f2a149da1acd12dfb8de99cbdc95,Region reason any little long involve prove. Anything send town seat live.,Thus relationship by industry summer management organization prove.,ffbd0536-6478-42bc-b5c9-7995a84222e5,0.66,0.87,robinson.com,tax,488,399,42,160,125,4727,South,Ebolowa,1f92dab720749f8d04e887266e684ccf6ba3bbfae6116c894383ff8844ddaecb
Event,"Myself whole tend poor compare. Ever article debate break.
Boy various agency. Throw life surface police.",CAMTEL,Facebook,Commenter,2023-08-29 04:20:31,brittanyrichardson@example.com,alison13,M,89,80s,91a4925c5a75ffcfb8cce0bb6bfa2d98,Both campaign well result. Eye too term note treat case real bring.,Age head nice network buy spring. Law no analysis lose through threat.,990402c2-21e8-4ce4-8557-c544b35745a7,0.75,0.71,oneal.com,night,101,219,71,92,157,8871,Northwest,Bertoua,98b2e9bd6f5d00de457bbce41ea42ee1aa879748b5aea6002bbdf5aa38685029
Ad,Before argue by past cell difference charge certainly. One throughout onto which think. Follow lot other baby. Will beyond task democratic.,MTN,Facebook,Poster,2015-03-09 01:24:13,tracyhall@example.net,lisa48,F,93,90s-100s,ebd7a17c585f98957c08fd2d2dfb6170,Set special bad. Perhaps assume research series form.,Project newspaper actually prevent million good.,d4293762-734a-40d6-945a-611c7549b27f,0.18,0.74,spencer.com,these,925,51,44,257,9,6332,Far North,Garoua,025d535aef8be3d6329ceb260fe8724c585c176a4dedaf65347aec3780c6d88a
Survey,"System game score station yard white issue group. Ever admit turn tax will should finally. Form task somebody trial no wind.
Laugh chance trade available fact. Left people writer under politics up.",MTN,Twitter,Commenter,2024-12-10 15:09:46,robertferguson@example.net,kimberly96,F,77,70s,35bd5bfad95c92bbf4fdcec3b1ace708,By important very social throughout throughout can. Work education effect. Guy rule section.,Real among team bar little. Toward past continue morning. Computer once against truth.,f660df26-200a-456b-8409-8dca460da546,0.66,0.45,kirby-mayer.biz,recent,53,473,63,86,51,6167,West,Douala,ad4dd335842c43dbea5de3d511599867f378cac5c88a087265098218ed4ef511
Survey,Of fall young fear professional small record hospital. Series building prepare clear.,ORANGE,LinkedIn,Poster,2022-10-21 03:31:04,manuel25@example.net,murphyjoseph,M,72,70s,cd52c3d803fac63c29a7bff1e162051e,Human manage whom fly interview. Next knowledge sport statement raise happen officer order.,Hard sometimes according activity. Sit option almost face situation.,404d5cf8-f1a1-4ace-8b1a-3c1972cce097,0.63,0.05,mcclure-waters.com,hundred,253,219,30,211,52,8944,North,Ngaoundere,51ebc7fc19e65814f7e44039af3933642f12142958c7cc32b29ea818b336e0bc
Ad,"The others space present building head. Service civil make sometimes onto similar.
Report late institution gas. Much remember establish soon evidence baby.",CAMTEL,Twitter,Poster,2020-03-07 06:27:46,smithkelsey@example.com,landrysteven,M,83,80s,4de12b384570692fcc040973cd486128,Speech similar partner. Specific help building or treat talk race. Then project these ability.,Experience under common term power stock. Move ground everyone mind candidate study.,69aaa3d8-8505-48e9-b6e1-ae334665b1d1,0.64,0.95,ryan.net,main,498,98,48,138,162,9301,Central,Yaounde,49123b0bfbe7a8562094e828c7c4a9749968d63fce53719f7f6bdb6d9cee181d
Survey,"Book five prepare. Our agent than tree. Hot woman business respond center authority model.
Sport think charge. Have term throughout field.",MTN,Facebook,Poster,2016-11-14 20:03:38,timothy71@example.net,cody63,M,61,60s,4ef1712cbe40f5ded9f3b76680653395,According not reach rate. So identify cut most third song watch.,Per film understand produce along sell because agency. Enter machine single.,766e15d5-f3a2-47b0-986e-5e0f51a563bb,0.28,0.16,schneider-murray.com,ok,651,394,45,214,37,9333,Central,Bertoua,fda0ebaa3cbb9cc3a6e706d020c2f28de104738c6b81ca9e9917bcffc48380ee
Survey,Another despite drive blood throw range. Stage night subject always service spring bill. Bar everyone maybe community.,MTN,Twitter,Commenter,2023-12-11 04:50:00,iskinner@example.net,ashley25,F,10,Adolescent,6411010742f0226dab0391ac761f4835,Each soldier among change white quite career.,Line many maybe eat hundred million. Subject contain perform three. Speech teach analysis.,e1e413c1-3029-4ed0-a8f1-6aa80e39bc3b,0.05,0.25,haynes-brown.com,leader,548,356,64,203,81,2246,West,Garoua,c7fdc0bfb7e5d56823b59e9d7bda62f45984e86f4507070fe65ae72003827fd5
Event,Score spring pressure whether. Lay lose first story important better. Ago behavior car network. Admit from various report week employee approach.,ORANGE,Facebook,Commenter,2021-12-03 11:31:26,gonzalezthomas@example.net,mvaughn,M,92,90s-100s,483e9a13b8ede200a0022216bbe19bf4,Man chance institution community daughter. Care somebody site five kid from.,Wrong treat term former throughout whatever fight. Most door attorney police growth.,6a380cd4-9aba-4d77-9c04-797334c06761,0.18,0.01,cohen.com,dream,844,493,87,3,140,4781,Central,Ngaoundere,1ebd6d5e39b01f2d200c67753e040d152e908830fd919ad8620bd038dd5fe35e
Event,"Own along red piece coach law. Never total protect top whatever. Father local lawyer nothing year.
Glass voice peace easy. Financial machine six address near.",ORANGE,Twitter,Commenter,2020-11-03 00:26:27,hillbradley@example.com,smithdaniel,M,76,70s,9a9c9d401dfd44be9ae2dfb07d151343,Wonder child change. Us at interesting pull.,Million word cost note he. It left Congress significant industry.,7a011fce-743d-4585-81d2-4ce14903aaa3,0.9,0.01,johnson-ford.com,late,643,7,79,92,121,6915,Southwest,Bertoua,b7d899a77954f9bc474850f33d4c27a755e3a411f59265d1c67475ad5d163313
Survey,"Business return adult politics go. Degree television wall book involve everyone onto.
Red fund vote. Hear believe blue alone education really management. College usually charge early change.",MTN,Facebook,Commenter,2017-02-25 04:54:06,smithlisa@example.com,daniel49,M,68,60s,3d166a4298a219812c1cb5a54a877f71,Travel stop region line. Treat alone democratic small money. Begin the owner fire mother.,Would condition section he. Must rather decision safe. Manage too strong enter green surface.,4d28c454-7129-4824-b162-0a9faa9c3c7a,0.35,0.08,donaldson.com,hair,535,322,38,62,3,4296,Central,Maroua,625565b206d908a9a10ba452de035e06b10387c34edf955e41d8dbb88f6b457e
Event,"Nation charge plant company friend. Account prove probably home type rule. Like technology discuss among spend. Language down course.
Thousand send every put interest.",MTN,Twitter,Poster,2018-05-16 03:15:17,david52@example.com,michaelramirez,M,39,Late-30s,3742ed3a0ad8fa51870f0a90d2d46b0e,Positive identify general direction look. When team any. Through air seven blood nice pass.,Your individual environmental. Morning up common we notice yard.,9896af22-7af0-45e9-909b-d81201810c51,0.07,0.16,martinez.com,job,194,448,78,267,149,9453,Far North,Bafoussam,a7374a05efef947d13d82e1b019264c0637a76ab85544103e7cf255587df8271
Event,"New girl clearly friend include carry success. Safe available example all. Determine trial citizen call house describe bed rather.
Expect face although short. Long game process.",MTN,LinkedIn,Commenter,2017-03-20 16:07:49,randysummers@example.com,martinlisa,M,39,Late-30s,6ac8c3539786f9caf284de1999c05481,High population big country ever believe.,Behavior indeed ground. Man again fill her group allow evidence. Next camera attack professor no.,e56e7311-d0f7-4b81-9115-cb897a83cf03,0.64,0.67,bowen.com,and,355,346,69,18,63,4447,Far North,Bamenda,1489863f0271f5168d6f53dac20ac73b8c66d344f5a1dc3112311cefee61ab2c
Event,"Charge usually fine bring pressure. Page attorney behavior company pick response. Would like west possible rule.
Foreign across theory entire. Watch rich oil north any network.",CAMTEL,LinkedIn,Commenter,2015-07-12 17:19:41,peter79@example.net,anthonytorres,M,71,70s,97eb83aa0900f08c2f48d60db6d80f08,Actually step boy idea amount support. Herself professional room health item main.,Truth speak science. Sound return society might.,3b63ef18-becc-4c30-8b77-2ff075798c56,0.88,0.87,rosales.com,perform,316,490,75,21,113,7291,Littoral,Ebolowa,d440594bfe8dea51c45971d4e20615477c26e1c25e20b35da573f9743c3c64d4
